{
  "$schema": "../../schemas/reader-safety-conformance-suite-v2.schema.json",
  "schemaVersion": 1,
  "policyId": "shuku.reader-safety",
  "policyVersion": 5,
  "policyDigest": "3dc406a17303ec05476fddca6c161f2213494e8901ab00ffd145441428f5d79a",
  "fixtureManifest": "manifest.json",
  "cases": [
    {
      "id": "safe-xhtml-11-http",
      "ruleId": "REFLOWABLE.SAFE_STANDARD_DOCTYPE",
      "evaluator": "REFLOWABLE_MARKUP",
      "semanticProjection": "ROOT_LOCAL_NAME",
      "consumers": [
        "BACKEND",
        "WEB",
        "KMP",
        "ANDROID",
        "IOS"
      ]
    },
    {
      "id": "safe-xhtml-11-https",
      "ruleId": "REFLOWABLE.SAFE_STANDARD_DOCTYPE",
      "evaluator": "REFLOWABLE_MARKUP",
      "semanticProjection": "ROOT_LOCAL_NAME",
      "consumers": [
        "BACKEND",
        "WEB",
        "KMP",
        "ANDROID",
        "IOS"
      ]
    },
    {
      "id": "safe-xhtml-named-entities",
      "ruleId": "REFLOWABLE.SAFE_STANDARD_DOCTYPE",
      "evaluator": "REFLOWABLE_NAMED_ENTITIES",
      "semanticProjection": "ROOT_LOCAL_NAME",
      "consumers": [
        "BACKEND",
        "WEB",
        "KMP",
        "ANDROID",
        "IOS"
      ]
    },
    {
      "id": "xml-internal-entity",
      "ruleId": "REFLOWABLE.PREPARE_XML",
      "evaluator": "REFLOWABLE_MARKUP",
      "semanticProjection": "ROOT_LOCAL_NAME",
      "consumers": [
        "BACKEND",
        "WEB",
        "KMP",
        "ANDROID",
        "IOS"
      ]
    },
    {
      "id": "xml-external-entity",
      "ruleId": "REFLOWABLE.PREPARE_XML",
      "evaluator": "REFLOWABLE_MARKUP",
      "semanticProjection": "ROOT_LOCAL_NAME",
      "consumers": [
        "BACKEND",
        "WEB",
        "KMP",
        "ANDROID",
        "IOS"
      ]
    },
    {
      "id": "markup-active-elements",
      "ruleId": "REFLOWABLE.SANITIZE_MARKUP",
      "evaluator": "REFLOWABLE_MARKUP_SANITIZE",
      "semanticProjection": "SANITIZED_MARKUP",
      "consumers": [
        "BACKEND",
        "WEB",
        "KMP",
        "ANDROID",
        "IOS"
      ]
    },
    {
      "id": "author-dangerous-uri",
      "ruleId": "REFLOWABLE.SANITIZE_URI",
      "evaluator": "REFLOWABLE_URI",
      "semanticProjection": "SANITIZED_MARKUP",
      "consumers": [
        "BACKEND",
        "WEB",
        "KMP",
        "ANDROID",
        "IOS"
      ]
    },
    {
      "id": "css-active-content",
      "ruleId": "REFLOWABLE.SANITIZE_CSS",
      "evaluator": "REFLOWABLE_CSS",
      "semanticProjection": "SANITIZED_TEXT",
      "consumers": [
        "BACKEND",
        "WEB",
        "KMP",
        "ANDROID",
        "IOS"
      ]
    },
    {
      "id": "svg-active-content",
      "ruleId": "REFLOWABLE.SANITIZE_SVG",
      "evaluator": "REFLOWABLE_SVG",
      "semanticProjection": "SANITIZED_MARKUP",
      "consumers": [
        "BACKEND",
        "WEB",
        "KMP",
        "ANDROID",
        "IOS"
      ]
    },
    {
      "id": "archive-path-escape",
      "ruleId": "EPUB.ARCHIVE_STRUCTURE",
      "evaluator": "ARCHIVE_STRUCTURE",
      "semanticProjection": "NONE",
      "consumers": [
        "BACKEND",
        "WEB",
        "ANDROID",
        "IOS"
      ]
    },
    {
      "id": "archive-duplicate",
      "ruleId": "EPUB.RESOURCE_INTEGRITY",
      "evaluator": "ARCHIVE_STRUCTURE",
      "semanticProjection": "NONE",
      "consumers": [
        "BACKEND",
        "WEB",
        "ANDROID",
        "IOS"
      ]
    },
    {
      "id": "archive-unused-entry-crc-mismatch",
      "ruleId": "REFLOWABLE.OPTIONAL_RESOURCE_FAILURE",
      "evaluator": "EPUB_ARCHIVE_CRC",
      "semanticProjection": "NONE",
      "consumers": [
        "BACKEND",
        "WEB",
        "ANDROID",
        "IOS"
      ]
    },
    {
      "id": "original-at-limit",
      "ruleId": "COMMON.ORIGINAL_MAX_BYTES",
      "evaluator": "ORIGINAL_BYTES",
      "semanticProjection": "INPUT",
      "consumers": [
        "KMP",
        "ANDROID",
        "IOS"
      ]
    },
    {
      "id": "original-over-limit",
      "ruleId": "COMMON.ORIGINAL_MAX_BYTES",
      "evaluator": "ORIGINAL_BYTES",
      "semanticProjection": "NONE",
      "consumers": [
        "KMP",
        "ANDROID",
        "IOS"
      ]
    },
    {
      "id": "fb2-node-over-limit",
      "ruleId": "FB2.STRUCTURE_BUDGET",
      "evaluator": "FB2_STRUCTURE",
      "semanticProjection": "NONE",
      "consumers": [
        "KMP",
        "ANDROID",
        "IOS"
      ]
    },
    {
      "id": "pdf-active-actions",
      "ruleId": "PDF.DISABLE_ACTIVE_CONTENT",
      "evaluator": "PDF_ACTIVE_ACTIONS",
      "semanticProjection": "SANITIZED_TEXT",
      "consumers": [
        "WEB",
        "ANDROID",
        "IOS"
      ]
    },
    {
      "id": "pdf-page-over-limit",
      "ruleId": "PDF.PAGE_GEOMETRY",
      "evaluator": "PDF_PAGE_GEOMETRY",
      "semanticProjection": "NONE",
      "consumers": [
        "ANDROID",
        "IOS"
      ]
    },
    {
      "id": "pdf-invalid-range",
      "ruleId": "PDF.RANGE_PROTOCOL",
      "evaluator": "PDF_RANGE_PROTOCOL",
      "semanticProjection": "NONE",
      "consumers": [
        "BACKEND",
        "WEB",
        "KMP",
        "ANDROID",
        "IOS"
      ]
    },
    {
      "id": "comic-mime-mismatch",
      "ruleId": "COMIC.PAGE_MIME",
      "evaluator": "COMIC_PAGE_MIME",
      "semanticProjection": "INPUT",
      "consumers": [
        "BACKEND",
        "WEB",
        "KMP",
        "ANDROID",
        "IOS"
      ]
    },
    {
      "id": "comic-page-count-over-limit",
      "ruleId": "COMIC.PAGE_MAX_COUNT",
      "evaluator": "COMIC_PAGE_COUNT",
      "semanticProjection": "NONE",
      "consumers": [
        "KMP",
        "ANDROID",
        "IOS"
      ]
    },
    {
      "id": "comic-page-decode-failure",
      "ruleId": "COMIC.PAGE_DECODE_FAILURE",
      "evaluator": "COMIC_PAGE_DECODE",
      "semanticProjection": "NONE",
      "consumers": [
        "WEB",
        "ANDROID",
        "IOS"
      ]
    },
    {
      "id": "comic-revision-mismatch",
      "ruleId": "COMIC.MANIFEST_REVISION",
      "evaluator": "COMIC_REVISION",
      "semanticProjection": "NONE",
      "consumers": [
        "BACKEND",
        "WEB",
        "KMP",
        "ANDROID",
        "IOS"
      ]
    },
    {
      "id": "audio-mime-mismatch",
      "ruleId": "AUDIO.CONTAINER_MIME",
      "evaluator": "AUDIO_CONTAINER_MIME",
      "semanticProjection": "INPUT",
      "consumers": [
        "BACKEND",
        "WEB",
        "ANDROID",
        "IOS"
      ]
    },
    {
      "id": "audio-codec-unsupported",
      "ruleId": "AUDIO.ENGINE_CODEC",
      "evaluator": "AUDIO_CODEC",
      "semanticProjection": "NONE",
      "consumers": [
        "WEB",
        "ANDROID",
        "IOS"
      ]
    },
    {
      "id": "audio-invalid-chapter",
      "ruleId": "AUDIO.TRACK_AND_CHAPTER_BOUNDS",
      "evaluator": "AUDIO_CHAPTER_BOUNDS",
      "semanticProjection": "NONE",
      "consumers": [
        "ANDROID",
        "IOS"
      ]
    },
    {
      "id": "epub-font-obfuscation",
      "ruleId": "COMMON.DRM_REJECTED",
      "evaluator": "DRM_ALGORITHM",
      "semanticProjection": "FONT_OBFUSCATION",
      "consumers": [
        "BACKEND",
        "WEB",
        "KMP",
        "ANDROID",
        "IOS"
      ]
    },
    {
      "id": "epub-drm-rejected",
      "ruleId": "COMMON.DRM_REJECTED",
      "evaluator": "DRM_ALGORITHM",
      "semanticProjection": "INPUT",
      "consumers": [
        "BACKEND",
        "WEB",
        "KMP",
        "ANDROID",
        "IOS"
      ]
    },
    {
      "id": "format-mime-mismatch",
      "ruleId": "COMMON.EXACT_FORMAT_MIME",
      "evaluator": "EXACT_FORMAT_MIME",
      "semanticProjection": "INPUT",
      "consumers": [
        "BACKEND",
        "WEB",
        "KMP",
        "ANDROID",
        "IOS"
      ]
    },
    {
      "id": "binary-resource-over-limit",
      "ruleId": "COMMON.BINARY_RESOURCE_MAX_BYTES",
      "evaluator": "BINARY_RESOURCE_BYTES",
      "semanticProjection": "NONE",
      "consumers": [
        "KMP",
        "ANDROID",
        "IOS"
      ]
    },
    {
      "id": "optional-resource-missing",
      "ruleId": "REFLOWABLE.OPTIONAL_RESOURCE_FAILURE",
      "evaluator": "OPTIONAL_RESOURCE",
      "semanticProjection": "NONE",
      "consumers": [
        "BACKEND",
        "WEB",
        "KMP",
        "ANDROID",
        "IOS"
      ]
    },
    {
      "id": "required-reading-order-markup-missing",
      "ruleId": "REFLOWABLE.REQUIRED_READING_ORDER_MARKUP",
      "evaluator": "REQUIRED_READING_ORDER_MARKUP",
      "semanticProjection": "NONE",
      "consumers": [
        "BACKEND",
        "WEB",
        "KMP",
        "ANDROID",
        "IOS"
      ]
    },
    {
      "id": "xml-control-document-over-limit",
      "ruleId": "REFLOWABLE.XML_CONTROL_DOCUMENT_MAX_BYTES",
      "evaluator": "XML_CONTROL_DOCUMENT_BYTES",
      "semanticProjection": "NONE",
      "consumers": [
        "KMP",
        "ANDROID",
        "IOS"
      ]
    },
    {
      "id": "reflowable-markup-over-limit",
      "ruleId": "REFLOWABLE.MARKUP_MAX_BYTES",
      "evaluator": "REFLOWABLE_MARKUP_BYTES",
      "semanticProjection": "NONE",
      "consumers": [
        "KMP",
        "ANDROID",
        "IOS"
      ]
    },
    {
      "id": "epub-entry-count-over-limit",
      "ruleId": "EPUB.ARCHIVE_ENTRY_MAX_COUNT",
      "evaluator": "EPUB_ARCHIVE_ENTRY_COUNT",
      "semanticProjection": "NONE",
      "consumers": [
        "ANDROID",
        "IOS"
      ]
    },
    {
      "id": "epub-expanded-over-limit",
      "ruleId": "EPUB.ARCHIVE_EXPANDED_MAX_BYTES",
      "evaluator": "EPUB_ARCHIVE_EXPANDED_BYTES",
      "semanticProjection": "NONE",
      "consumers": [
        "ANDROID",
        "IOS"
      ]
    },
    {
      "id": "epub-entry-over-limit",
      "ruleId": "EPUB.ARCHIVE_ENTRY_MAX_BYTES",
      "evaluator": "EPUB_ARCHIVE_ENTRY_BYTES",
      "semanticProjection": "NONE",
      "consumers": [
        "ANDROID",